<?xml version="1.0" encoding="UTF-8"?><!--  Les changements de fond du reseau (ajout/suppression de stations/lignes/troncons seront geres par le chargement d'un nouveau reseau complet).Ce document XML decrit les changements temporaires qui contiennent 3 listes :     (1) les stations (toutes lignes confondues),     (2) les stations sur une ligne donnee     (3) les lignes toutes entieres qui sont bloques (Problem) momentanement tant qu'un message de deblocage(Solution) n'a pas ete proposé. Un message d'alerte leur est associe.Une identifiant est associe a chaque probleme (MSID) et chaque solution fait reference au probleme qu'elle regle en utilisant cet identifiant.Un problème restera dans les fichiers mis à jour tant qu'il n'est pas résolu. Une fois une solution diffusée pour ce problème il ne sera plus présent dans les fichiers (y compris dans celui contenant la résolution).Ainsi quand le système se lance il est certain que vous disporez de tous les problèmes en cours, vous n'aurez pas à tenir compte des solutions de ce premier fichier.--><TravelAlert xmlns:xsi="http://www.w3.org/2001/XMLSchema-instance" xsi:noNamespaceSchemaLocation="TravelAltertGL2008.xsd">	<VersionNumber>16</VersionNumber>	<StationsList>		<Station>			<MSID>110</MSID>			<ID>152</ID>			<Kind>Problem</Kind>			<WarningMsg>Closed for construction</WarningMsg>		</Station>	</StationsList></TravelAlert>